{"schema":"weather-calendar-v1","snapshot_id":"weather-20260803T100000Z-stale","generated_at":"2026-08-03T10:00:00Z","valid_until":"2026-08-03T13:00:00Z","timezone":"Europe/Kaliningrad","provider":{"name":"Open-Meteo","attribution_url":"https://open-meteo.com/"},"location_revision":"kotopogoda-fixture-locations-20260803","days":[{"date":"2026-08-03","kaliningrad":{"status":"fresh","temperature_day_min_c":19.1,"temperature_day_max_c":24.2,"weather_code":1,"wind_day_max_m_s":4.7,"source_updated_at":"2026-08-03T17:45:00Z"},"coast":{"status":"fresh","temperature_day_min_c":17,"temperature_day_max_c":21.1,"weather_code":2,"sea_surface_temperature_c":16.04,"wave_height_day_max_m":0.3,"show_water_temperature":false,"source_updated_at":"2026-08-03T17:45:00Z"}},{"date":"2026-08-04","kaliningrad":{"status":"fresh","temperature_day_min_c":18.8,"temperature_day_max_c":23.6,"weather_code":0,"source_updated_at":"2026-08-03T17:45:00Z"},"coast":{"status":"fresh","temperature_day_min_c":16.8,"temperature_day_max_c":20.4,"weather_code":3,"sea_surface_temperature_c":16.05,"show_water_temperature":true,"source_updated_at":"2026-08-03T17:45:00Z"}},{"date":"2026-08-05","kaliningrad":{"status":"fresh","temperature_day_min_c":16,"temperature_day_max_c":22,"weather_code":45,"source_updated_at":"2026-08-03T17:45:00Z"}},{"date":"2026-08-06","coast":{"status":"fresh","temperature_day_min_c":15,"temperature_day_max_c":19,"weather_code":61,"source_updated_at":"2026-08-03T17:45:00Z"}},{"date":"2026-08-07","coast":{"status":"degraded","sea_surface_temperature_c":17.4,"show_water_temperature":true,"source_updated_at":"2026-08-03T17:45:00Z"}},{"date":"2026-08-08","kaliningrad":{"status":"fresh","temperature_day_min_c":15,"temperature_day_max_c":20,"weather_code":80,"source_updated_at":"2026-08-03T17:45:00Z"}},{"date":"2026-08-09","kaliningrad":{"status":"fresh","temperature_day_min_c":18,"temperature_day_max_c":25,"weather_code":0,"source_updated_at":"2026-08-03T17:45:00Z"}}],"errors":[]}
